{
  "schema_version": "1.0.0",
  "framework": "langchain/langgraph",
  "format": "langgraph-state-graph",
  "flow": {
    "id": "人才画像20260914150500",
    "name": "人才画像20260914150500",
    "description": "工作流",
    "category": 17,
    "dsl_version": "v1",
    "avatar_icon": "https://openres.xfyun.cn/xfyundoc/2026-01-13/68cb686b-ad05-45da-8376-45a4c9ce3fcc/1768290620925/5%402x.png",
    "avatar_color": "#FFEAD5",
    "advanced_config": {
      "prologue": {
        "enabled": true,
        "inputExample": [
          "",
          "",
          ""
        ]
      },
      "textToSpeech": {
        "enabled": true,
        "vcn_cn": "x4_lingxiaoqi",
        "vcn_en": "x4_EnUs_Luna"
      },
      "needGuide": false
    },
    "advanced_config_raw": "{\"prologue\":{\"enabled\":true,\"inputExample\":[\"\",\"\",\"\"]},\"textToSpeech\":{\"enabled\":true,\"vcn_cn\":\"x4_lingxiaoqi\",\"vcn_en\":\"x4_EnUs_Luna\"},\"needGuide\":false}"
  },
  "state": {
    "schema": {
      "AGENT_USER_INPUT": {
        "type": "string",
        "default": "用户本轮对话输入内容",
        "required": true,
        "producer": "start"
      },
      "output": {
        "type": "string",
        "default": "",
        "producer": "subject_selector"
      },
      "code": {
        "type": "string",
        "default": "",
        "producer": "split_input"
      },
      "item": {
        "type": "string",
        "default": "",
        "producer": "split_input"
      },
      "output2": {
        "type": "string",
        "default": "",
        "producer": "question_generator"
      },
      "output3": {
        "type": "string",
        "default": "",
        "producer": "wrong_answer_diagnoser"
      },
      "final_output": {
        "type": "string",
        "default": "",
        "producer": "end"
      }
    },
    "defaults": {
      "AGENT_USER_INPUT": "用户本轮对话输入内容",
      "output": "",
      "code": "",
      "item": "",
      "output2": "",
      "output3": "",
      "final_output": ""
    }
  },
  "models": {
    "default": {
      "provider": "openai-compatible",
      "base_url": "https://ws-uxxtz5szu7puw1so.cn-beijing.maas.aliyuncs.com/compatible-mode/v1",
      "model_name": "qwen3.8-flash",
      "temperature": 1,
      "timeout_seconds": 120,
      "api_key_env": "DASHSCOPE_API_KEY",
      "provider_options": {
        "source": "openai",
        "model_name": "deepseek",
        "model_id": 10799,
        "llm_id": 668249608,
        "service_id": "deepseek-flash",
        "domain": "deepseek-flash",
        "app_id": "12a0a7e2",
        "uid": "21780452610",
        "url": "https://api.deepseek.com/v1/chat/completions",
        "temperature": 1,
        "enable_chat_history": {
          "isEnabled": false,
          "rounds": 1
        },
        "auditing": "default",
        "resp_format": 0,
        "is_think": false,
        "search_disable": true
      }
    }
  },
  "graph": {
    "entrypoint": "node-start::d61b0f71-87ee-475e-93ba-f1607f0ce783",
    "finish_point": "node-end::cda617af-551e-462e-b3b8-3bb9a041bf88",
    "entrypoint_runtime": "start",
    "finish_runtime": "end",
    "nodes": [
      {
        "id": "node-start::d61b0f71-87ee-475e-93ba-f1607f0ce783",
        "runtime_name": "start",
        "type": "start",
        "iflytek_type": "开始节点",
        "name": "开始",
        "alias": "开始节点",
        "node_meta": {
          "aliasName": "开始节点",
          "nodeType": "基础节点"
        },
        "description": "工作流的开启节点，用于定义流程调用所需的业务变量信息。",
        "position": {
          "x": -319.50681743332655,
          "y": 347.19586299263585
        },
        "position_absolute": {
          "x": -319.50681743332655,
          "y": 347.19586299263585
        },
        "size": {
          "width": 256,
          "height": 74
        },
        "icon": "https://oss-beijing-m8.openstorage.cn/pro-bucket/sparkBot/common/workflow/icon/start-node-icon.png",
        "flags": {
          "dragging": false,
          "selected": false,
          "updatable": false,
          "allow_input_reference": false,
          "allow_output_reference": true,
          "label_edit": null
        },
        "references": [],
        "status": "",
        "inputs": [],
        "outputs": [
          {
            "id": "0918514b-72a8-4646-8dd9-ff4a8fc26d44",
            "name": "AGENT_USER_INPUT",
            "name_err_msg": "",
            "type": "string",
            "default": "用户本轮对话输入内容",
            "schema": {
              "type": "string",
              "default": "用户本轮对话输入内容"
            }
          }
        ],
        "node_param": {},
        "state_writes": {
          "AGENT_USER_INPUT": {
            "type": "string",
            "default": "用户本轮对话输入内容",
            "required": true
          }
        }
      },
      {
        "id": "node-end::cda617af-551e-462e-b3b8-3bb9a041bf88",
        "runtime_name": "end",
        "type": "end",
        "iflytek_type": "结束节点",
        "name": "结束",
        "alias": "结束节点",
        "node_meta": {
          "aliasName": "结束节点",
          "nodeType": "基础节点"
        },
        "description": "工作流的结束节点，用于输出工作流运行后的最终结果。",
        "position": {
          "x": 1073.5330274084317,
          "y": 226.2275263785985
        },
        "position_absolute": {
          "x": 1073.5330274084317,
          "y": 226.2275263785985
        },
        "size": {
          "width": 264,
          "height": 74
        },
        "icon": "https://oss-beijing-m8.openstorage.cn/pro-bucket/sparkBot/common/workflow/icon/end-node-icon.png",
        "flags": {
          "dragging": false,
          "selected": false,
          "updatable": false,
          "allow_input_reference": true,
          "allow_output_reference": false,
          "label_edit": null
        },
        "references": [],
        "status": "",
        "inputs": [
          {
            "id": "1f34c1ef-12dc-45cc-9be3-cefd8a705d17",
            "name": "output",
            "name_err_msg": "",
            "type": "string",
            "file_type": "",
            "schema": {
              "type": "string",
              "value": {
                "type": "ref",
                "content": {
                  "name": "output",
                  "id": "ee45137c-c58e-4995-b62c-996001202002",
                  "nodeId": "spark-llm::a3a568ee-8806-48e4-abfc-3710aeb47f3e"
                },
                "contentErrMsg": ""
              }
            },
            "from": {
              "kind": "ref",
              "node_id": "spark-llm::a3a568ee-8806-48e4-abfc-3710aeb47f3e",
              "output": "output",
              "output_id": "ee45137c-c58e-4995-b62c-996001202002"
            }
          },
          {
            "id": "20ef57ba-95c0-446d-9dd5-b6da081e2034",
            "name": "output2",
            "name_err_msg": "",
            "type": "string",
            "file_type": "",
            "schema": {
              "type": "string",
              "value": {
                "type": "ref",
                "content": {
                  "name": "output",
                  "id": "f02490a1-ec19-406d-b6a0-93f091a3a743",
                  "nodeId": "spark-llm::25a3c442-3112-44bb-af11-229728051a9c"
                },
                "contentErrMsg": ""
              }
            },
            "from": {
              "kind": "ref",
              "node_id": "spark-llm::25a3c442-3112-44bb-af11-229728051a9c",
              "output": "output",
              "output_id": "f02490a1-ec19-406d-b6a0-93f091a3a743"
            }
          },
          {
            "id": "e7f2bc0d-ac50-43e0-aa3b-2423b0b16c2f",
            "name": "output3",
            "name_err_msg": "",
            "type": "string",
            "file_type": "",
            "schema": {
              "type": "string",
              "value": {
                "type": "ref",
                "content": {
                  "name": "output",
                  "id": "39c1c529-92dd-4be0-b4e7-b589f5783823",
                  "nodeId": "spark-llm::dcac176c-0898-4b5f-a880-ccfeafeb20f1"
                },
                "contentErrMsg": ""
              }
            },
            "from": {
              "kind": "ref",
              "node_id": "spark-llm::dcac176c-0898-4b5f-a880-ccfeafeb20f1",
              "output": "output",
              "output_id": "39c1c529-92dd-4be0-b4e7-b589f5783823"
            }
          }
        ],
        "outputs": [],
        "node_param": {
          "template": "{{output}}{{output2}}{{output3}}",
          "streamOutput": false,
          "templateErrMsg": "",
          "outputMode": 1
        },
        "output": {
          "template": "{{output}}{{output2}}{{output3}}",
          "stream_output": false,
          "output_mode": 1,
          "input_keys": [
            {
              "end_input": "output",
              "state_key": "output",
              "node_id": "spark-llm::a3a568ee-8806-48e4-abfc-3710aeb47f3e",
              "output": "output",
              "output_id": "ee45137c-c58e-4995-b62c-996001202002"
            },
            {
              "end_input": "output2",
              "state_key": "output2",
              "node_id": "spark-llm::25a3c442-3112-44bb-af11-229728051a9c",
              "output": "output",
              "output_id": "f02490a1-ec19-406d-b6a0-93f091a3a743"
            },
            {
              "end_input": "output3",
              "state_key": "output3",
              "node_id": "spark-llm::dcac176c-0898-4b5f-a880-ccfeafeb20f1",
              "output": "output",
              "output_id": "39c1c529-92dd-4be0-b4e7-b589f5783823"
            }
          ],
          "state_keys": [
            "output",
            "output2",
            "output3"
          ]
        }
      },
      {
        "id": "spark-llm::a3a568ee-8806-48e4-abfc-3710aeb47f3e",
        "runtime_name": "subject_selector",
        "type": "llm",
        "iflytek_type": "大模型",
        "name": "大模型_1",
        "alias": "大模型",
        "node_meta": {